{"Ansible": [2, "/categories/ansible/", {"posts": [{"date": "07/18/2017", "isodate": "2017-07-18T22:46:17+02:00", "title": "Experimenting with asyncio on a Raspberry Pi", "url": "/posts/experimenting-with-asyncio-on-a-raspberry-pi/"}, {"date": "07/18/2016", "isodate": "2016-07-18T22:26:28+02:00", "title": "Installing OpenVPN on a Raspberry Pi with Ansible", "url": "/posts/installing-openvpn-on-a-raspberry-pi-with-ansible/"}]}], "AppleTV": [1, "/categories/appletv/", {"posts": [{"date": "01/20/2017", "isodate": "2017-01-20T21:46:16+01:00", "title": "OpenVPN source based routing", "url": "/posts/openvpn-source-based-routing/"}]}], "LXC": [2, "/categories/lxc/", {"posts": [{"date": "02/16/2017", "isodate": "2017-02-16T22:58:56+01:00", "title": "Control your accessories from Home Assistant with Siri and HomeKit", "url": "/posts/control-your-accessories-from-home-assistant-with-siri-and-homekit/"}, {"date": "01/26/2017", "isodate": "2017-01-26T22:01:30+01:00", "title": "Home Assistant on Turris Omnia via LXC container", "url": "/posts/home-assistant-on-turris-omnia-via-lxc-container/"}]}], "Mac": [2, "/categories/mac/", {"posts": [{"date": "05/23/2017", "isodate": "2017-05-23T22:39:12+02:00", "title": "My LEGO Macintosh Classic with Raspberry Pi and e-paper display", "url": "/posts/my-lego-macintosh-classic-with-raspberry-pi-and-e-paper-display/"}, {"date": "01/10/2016", "isodate": "2016-01-10T22:10:42+01:00", "title": "Compile and install Kodi on iPad without jailbreak", "url": "/posts/compile-and-install-kodi-on-ipad-without-jailbreak/"}]}], "OSX": [1, "/categories/osx/", {"posts": [{"date": "01/10/2016", "isodate": "2016-01-10T22:10:42+01:00", "title": "Compile and install Kodi on iPad without jailbreak", "url": "/posts/compile-and-install-kodi-on-ipad-without-jailbreak/"}]}], "OpenWrt": [2, "/categories/openwrt/", {"posts": [{"date": "01/26/2017", "isodate": "2017-01-26T22:01:30+01:00", "title": "Home Assistant on Turris Omnia via LXC container", "url": "/posts/home-assistant-on-turris-omnia-via-lxc-container/"}, {"date": "01/20/2017", "isodate": "2017-01-20T21:46:16+01:00", "title": "OpenVPN source based routing", "url": "/posts/openvpn-source-based-routing/"}]}], "VPN": [3, "/categories/vpn/", {"posts": [{"date": "01/26/2017", "isodate": "2017-01-26T22:01:30+01:00", "title": "Home Assistant on Turris Omnia via LXC container", "url": "/posts/home-assistant-on-turris-omnia-via-lxc-container/"}, {"date": "01/20/2017", "isodate": "2017-01-20T21:46:16+01:00", "title": "OpenVPN source based routing", "url": "/posts/openvpn-source-based-routing/"}, {"date": "07/18/2016", "isodate": "2016-07-18T22:26:28+02:00", "title": "Installing OpenVPN on a Raspberry Pi with Ansible", "url": "/posts/installing-openvpn-on-a-raspberry-pi-with-ansible/"}]}], "Xcode": [1, "/categories/xcode/", {"posts": [{"date": "01/10/2016", "isodate": "2016-01-10T22:10:42+01:00", "title": "Compile and install Kodi on iPad without jailbreak", "url": "/posts/compile-and-install-kodi-on-ipad-without-jailbreak/"}]}], "ajax": [1, "/categories/ajax/", {"posts": [{"date": "08/20/2016", "isodate": "2016-08-20T23:32:16+02:00", "title": "Running background tasks with Flask and RQ", "url": "/posts/running-background-tasks-with-flask-and-rq/"}]}], "bash": [1, "/categories/bash/", {"posts": [{"date": "01/18/2016", "isodate": "2016-01-18T22:42:39+01:00", "title": "crontab and date", "url": "/posts/crontab-and-date/"}]}], "ci": [2, "/categories/ci/", {"posts": [{"date": "09/21/2016", "isodate": "2016-09-21T22:10:06+02:00", "title": "GitLab Container Registry and proxy", "url": "/posts/gitlab-container-registry-and-proxy/"}, {"date": "05/31/2016", "isodate": "2016-05-31T16:48:23+02:00", "title": "GitLab CI and conda", "url": "/posts/gitlab-ci-and-conda/"}]}], "conda": [2, "/categories/conda/", {"posts": [{"date": "01/28/2017", "isodate": "2017-01-28T23:32:56+01:00", "title": "Docker and conda", "url": "/posts/docker-and-conda/"}, {"date": "05/31/2016", "isodate": "2016-05-31T16:48:23+02:00", "title": "GitLab CI and conda", "url": "/posts/gitlab-ci-and-conda/"}]}], "cron": [1, "/categories/cron/", {"posts": [{"date": "01/18/2016", "isodate": "2016-01-18T22:42:39+01:00", "title": "crontab and date", "url": "/posts/crontab-and-date/"}]}], "docker": [4, "/categories/docker/", {"posts": [{"date": "07/18/2017", "isodate": "2017-07-18T22:46:17+02:00", "title": "Experimenting with asyncio on a Raspberry Pi", "url": "/posts/experimenting-with-asyncio-on-a-raspberry-pi/"}, {"date": "03/16/2017", "isodate": "2017-03-16T22:10:49+01:00", "title": "Dockerfile anti-patterns and best practices", "url": "/posts/dockerfile-anti-patterns-and-best-practices/"}, {"date": "01/28/2017", "isodate": "2017-01-28T23:32:56+01:00", "title": "Docker and conda", "url": "/posts/docker-and-conda/"}, {"date": "09/21/2016", "isodate": "2016-09-21T22:10:06+02:00", "title": "GitLab Container Registry and proxy", "url": "/posts/gitlab-container-registry-and-proxy/"}]}], "elasticsearch": [1, "/categories/elasticsearch/", {"posts": [{"date": "11/16/2016", "isodate": "2016-11-16T21:59:23+01:00", "title": "Parsing and indexing PDF in Python", "url": "/posts/parsing-and-indexing-pdf-in-python/"}]}], "flask": [3, "/categories/flask/", {"posts": [{"date": "06/08/2017", "isodate": "2017-06-08T21:49:46+02:00", "title": "Running your application over HTTPS with traefik", "url": "/posts/running-your-application-over-https-with-traefik/"}, {"date": "08/20/2016", "isodate": "2016-08-20T23:32:16+02:00", "title": "Running background tasks with Flask and RQ", "url": "/posts/running-background-tasks-with-flask-and-rq/"}, {"date": "07/05/2016", "isodate": "2016-07-05T20:39:29+02:00", "title": "uWSGI, send_file and Python 3.5", "url": "/posts/uwsgi-send_file-and-python35/"}]}], "git": [3, "/categories/git/", {"posts": [{"date": "09/21/2016", "isodate": "2016-09-21T22:10:06+02:00", "title": "GitLab Container Registry and proxy", "url": "/posts/gitlab-container-registry-and-proxy/"}, {"date": "05/31/2016", "isodate": "2016-05-31T16:48:23+02:00", "title": "GitLab CI and conda", "url": "/posts/gitlab-ci-and-conda/"}, {"date": "01/30/2016", "isodate": "2016-01-30T21:55:32+01:00", "title": "Switching from git-bigfile to git-lfs", "url": "/posts/switching-from-git-bigfile-to-git-lfs/"}]}], "gitlab": [2, "/categories/gitlab/", {"posts": [{"date": "09/21/2016", "isodate": "2016-09-21T22:10:06+02:00", "title": "GitLab Container Registry and proxy", "url": "/posts/gitlab-container-registry-and-proxy/"}, {"date": "05/31/2016", "isodate": "2016-05-31T16:48:23+02:00", "title": "GitLab CI and conda", "url": "/posts/gitlab-ci-and-conda/"}]}], "gui": [1, "/categories/gui/", {"posts": [{"date": "12/28/2017", "isodate": "2017-12-28T21:31:25+01:00", "title": "Logging to a Tkinter ScrolledText Widget", "url": "/posts/logging-to-a-tkinter-scrolledtext-widget/"}]}], "home-assistant": [2, "/categories/home-assistant/", {"posts": [{"date": "02/16/2017", "isodate": "2017-02-16T22:58:56+01:00", "title": "Control your accessories from Home Assistant with Siri and HomeKit", "url": "/posts/control-your-accessories-from-home-assistant-with-siri-and-homekit/"}, {"date": "01/26/2017", "isodate": "2017-01-26T22:01:30+01:00", "title": "Home Assistant on Turris Omnia via LXC container", "url": "/posts/home-assistant-on-turris-omnia-via-lxc-container/"}]}], "https": [1, "/categories/https/", {"posts": [{"date": "06/08/2017", "isodate": "2017-06-08T21:49:46+02:00", "title": "Running your application over HTTPS with traefik", "url": "/posts/running-your-application-over-https-with-traefik/"}]}], "iOS": [2, "/categories/ios/", {"posts": [{"date": "02/16/2017", "isodate": "2017-02-16T22:58:56+01:00", "title": "Control your accessories from Home Assistant with Siri and HomeKit", "url": "/posts/control-your-accessories-from-home-assistant-with-siri-and-homekit/"}, {"date": "01/10/2016", "isodate": "2016-01-10T22:10:42+01:00", "title": "Compile and install Kodi on iPad without jailbreak", "url": "/posts/compile-and-install-kodi-on-ipad-without-jailbreak/"}]}], "iPad": [1, "/categories/ipad/", {"posts": [{"date": "01/10/2016", "isodate": "2016-01-10T22:10:42+01:00", "title": "Compile and install Kodi on iPad without jailbreak", "url": "/posts/compile-and-install-kodi-on-ipad-without-jailbreak/"}]}], "iPhone": [1, "/categories/iphone/", {"posts": [{"date": "01/10/2016", "isodate": "2016-01-10T22:10:42+01:00", "title": "Compile and install Kodi on iPad without jailbreak", "url": "/posts/compile-and-install-kodi-on-ipad-without-jailbreak/"}]}], "kodi": [1, "/categories/kodi/", {"posts": [{"date": "01/10/2016", "isodate": "2016-01-10T22:10:42+01:00", "title": "Compile and install Kodi on iPad without jailbreak", "url": "/posts/compile-and-install-kodi-on-ipad-without-jailbreak/"}]}], "lego": [2, "/categories/lego/", {"posts": [{"date": "07/18/2017", "isodate": "2017-07-18T22:46:17+02:00", "title": "Experimenting with asyncio on a Raspberry Pi", "url": "/posts/experimenting-with-asyncio-on-a-raspberry-pi/"}, {"date": "05/23/2017", "isodate": "2017-05-23T22:39:12+02:00", "title": "My LEGO Macintosh Classic with Raspberry Pi and e-paper display", "url": "/posts/my-lego-macintosh-classic-with-raspberry-pi-and-e-paper-display/"}]}], "linux": [1, "/categories/linux/", {"posts": [{"date": "01/18/2016", "isodate": "2016-01-18T22:42:39+01:00", "title": "crontab and date", "url": "/posts/crontab-and-date/"}]}], "pi": [4, "/categories/pi/", {"posts": [{"date": "07/18/2017", "isodate": "2017-07-18T22:46:17+02:00", "title": "Experimenting with asyncio on a Raspberry Pi", "url": "/posts/experimenting-with-asyncio-on-a-raspberry-pi/"}, {"date": "05/23/2017", "isodate": "2017-05-23T22:39:12+02:00", "title": "My LEGO Macintosh Classic with Raspberry Pi and e-paper display", "url": "/posts/my-lego-macintosh-classic-with-raspberry-pi-and-e-paper-display/"}, {"date": "01/20/2017", "isodate": "2017-01-20T21:46:16+01:00", "title": "OpenVPN source based routing", "url": "/posts/openvpn-source-based-routing/"}, {"date": "07/18/2016", "isodate": "2016-07-18T22:26:28+02:00", "title": "Installing OpenVPN on a Raspberry Pi with Ansible", "url": "/posts/installing-openvpn-on-a-raspberry-pi-with-ansible/"}]}], "python": [9, "/categories/python/", {"posts": [{"date": "12/28/2017", "isodate": "2017-12-28T21:31:25+01:00", "title": "Logging to a Tkinter ScrolledText Widget", "url": "/posts/logging-to-a-tkinter-scrolledtext-widget/"}, {"date": "07/18/2017", "isodate": "2017-07-18T22:46:17+02:00", "title": "Experimenting with asyncio on a Raspberry Pi", "url": "/posts/experimenting-with-asyncio-on-a-raspberry-pi/"}, {"date": "06/08/2017", "isodate": "2017-06-08T21:49:46+02:00", "title": "Running your application over HTTPS with traefik", "url": "/posts/running-your-application-over-https-with-traefik/"}, {"date": "05/23/2017", "isodate": "2017-05-23T22:39:12+02:00", "title": "My LEGO Macintosh Classic with Raspberry Pi and e-paper display", "url": "/posts/my-lego-macintosh-classic-with-raspberry-pi-and-e-paper-display/"}, {"date": "01/28/2017", "isodate": "2017-01-28T23:32:56+01:00", "title": "Docker and conda", "url": "/posts/docker-and-conda/"}, {"date": "11/16/2016", "isodate": "2016-11-16T21:59:23+01:00", "title": "Parsing and indexing PDF in Python", "url": "/posts/parsing-and-indexing-pdf-in-python/"}, {"date": "08/20/2016", "isodate": "2016-08-20T23:32:16+02:00", "title": "Running background tasks with Flask and RQ", "url": "/posts/running-background-tasks-with-flask-and-rq/"}, {"date": "07/05/2016", "isodate": "2016-07-05T20:39:29+02:00", "title": "uWSGI, send_file and Python 3.5", "url": "/posts/uwsgi-send_file-and-python35/"}, {"date": "05/31/2016", "isodate": "2016-05-31T16:48:23+02:00", "title": "GitLab CI and conda", "url": "/posts/gitlab-ci-and-conda/"}]}], "redis": [1, "/categories/redis/", {"posts": [{"date": "08/20/2016", "isodate": "2016-08-20T23:32:16+02:00", "title": "Running background tasks with Flask and RQ", "url": "/posts/running-background-tasks-with-flask-and-rq/"}]}], "rq": [1, "/categories/rq/", {"posts": [{"date": "08/20/2016", "isodate": "2016-08-20T23:32:16+02:00", "title": "Running background tasks with Flask and RQ", "url": "/posts/running-background-tasks-with-flask-and-rq/"}]}], "synology": [1, "/categories/synology/", {"posts": [{"date": "09/21/2016", "isodate": "2016-09-21T22:10:06+02:00", "title": "GitLab Container Registry and proxy", "url": "/posts/gitlab-container-registry-and-proxy/"}]}], "tika": [1, "/categories/tika/", {"posts": [{"date": "11/16/2016", "isodate": "2016-11-16T21:59:23+01:00", "title": "Parsing and indexing PDF in Python", "url": "/posts/parsing-and-indexing-pdf-in-python/"}]}], "tkinter": [1, "/categories/tkinter/", {"posts": [{"date": "12/28/2017", "isodate": "2017-12-28T21:31:25+01:00", "title": "Logging to a Tkinter ScrolledText Widget", "url": "/posts/logging-to-a-tkinter-scrolledtext-widget/"}]}], "traefik": [1, "/categories/traefik/", {"posts": [{"date": "06/08/2017", "isodate": "2017-06-08T21:49:46+02:00", "title": "Running your application over HTTPS with traefik", "url": "/posts/running-your-application-over-https-with-traefik/"}]}], "turris": [2, "/categories/turris/", {"posts": [{"date": "02/16/2017", "isodate": "2017-02-16T22:58:56+01:00", "title": "Control your accessories from Home Assistant with Siri and HomeKit", "url": "/posts/control-your-accessories-from-home-assistant-with-siri-and-homekit/"}, {"date": "01/26/2017", "isodate": "2017-01-26T22:01:30+01:00", "title": "Home Assistant on Turris Omnia via LXC container", "url": "/posts/home-assistant-on-turris-omnia-via-lxc-container/"}]}], "uwsgi": [1, "/categories/uwsgi/", {"posts": [{"date": "07/05/2016", "isodate": "2016-07-05T20:39:29+02:00", "title": "uWSGI, send_file and Python 3.5", "url": "/posts/uwsgi-send_file-and-python35/"}]}]}